{
 "$schema": "schemas/visual-render-evidence.schema.json",
 "schema_version": "1.0",
 "evidence_id": "render-evidence-abc1-b",
 "report_kind": "B",
 "report_version": "v1",
 "format": "html",
 "run_id": "run_662f71c21e2d862f99207cd8",
 "visual_plan_digest": "36da223867bdee3e778995bcad0e6e17e6e6d1e712e1b1ad0102135983cff0dd",
 "candidate_artifact_digest": "f983236a2d2b42519ea85c84dcb38fa09011a676e5deb9769fa26d79b4b638b9",
 "producer_identity": "zcode-main-thread-glm53",
 "render_targets": [
  {
   "target_id": "target-chromium-1440-overview",
   "engine": "chromium",
   "page_id": "overview",
   "viewport": {
    "width": 1440,
    "height": 900
   },
   "screenshot_path": "screenshots/B/chromium/1440__overview.html.png",
   "screenshot_sha256": "a2b21c6248343df138999b5de007785b7e27c6cf0dbe1da931c07cb9bc257262",
   "metrics": {
    "horizontal_overflow_px": 0,
    "clipped_text_count": 0,
    "label_overlap_count": 10575,
    "unreadable_label_count": 0
   },
   "unavailable_required_fields": [],
   "responsive_alternatives": [],
   "interaction_checks": [
    {
     "trigger": "page_load",
     "passed": true,
     "evidence": "加载完成且无页面错误（networkidle 到达）"
    },
    {
     "trigger": "filter_change",
     "passed": true,
     "evidence": "筛选控件真实点击（文本长度 66152→2504）"
    },
    {
     "trigger": "drill_down",
     "passed": true,
     "evidence": "折叠表真实展开"
    },
    {
     "trigger": "search",
     "passed": true,
     "evidence": "搜索框存在且接受输入（输入后文档文本长度 24169→66031）"
    },
    {
     "trigger": "keyboard",
     "passed": true,
     "evidence": "Tab 1 次后焦点位于 A"
    },
    {
     "trigger": "reduced_motion",
     "passed": true,
     "evidence": "减弱动效模拟下正文完整可见"
    }
   ],
   "visible_text_scan": {
    "passed": true,
    "engineering_tokens_found": [],
    "untranslated_tokens_found": []
   }
  },
  {
   "target_id": "target-chromium-1440-efficacy",
   "engine": "chromium",
   "page_id": "efficacy",
   "viewport": {
    "width": 1440,
    "height": 900
   },
   "screenshot_path": "screenshots/B/chromium/1440__efficacy.html.png",
   "screenshot_sha256": "68458d2703fd9a734226bb27980d71ff12df624d705faed8e37c13b265b5a165",
   "metrics": {
    "horizontal_overflow_px": 0,
    "clipped_text_count": 0,
    "label_overlap_count": 3427,
    "unreadable_label_count": 0
   },
   "unavailable_required_fields": [],
   "responsive_alternatives": [],
   "interaction_checks": [
    {
     "trigger": "page_load",
     "passed": true,
     "evidence": "加载完成且无页面错误（networkidle 到达）"
    },
    {
     "trigger": "filter_change",
     "passed": true,
     "evidence": "筛选控件真实点击（文本长度 60215→1438）"
    },
    {
     "trigger": "drill_down",
     "passed": true,
     "evidence": "折叠表真实展开"
    },
    {
     "trigger": "search",
     "passed": true,
     "evidence": "搜索框存在且接受输入（输入后文档文本长度 18232→60094）"
    },
    {
     "trigger": "keyboard",
     "passed": true,
     "evidence": "Tab 1 次后焦点位于 A"
    },
    {
     "trigger": "reduced_motion",
     "passed": true,
     "evidence": "减弱动效模拟下正文完整可见"
    }
   ],
   "visible_text_scan": {
    "passed": true,
    "engineering_tokens_found": [],
    "untranslated_tokens_found": []
   }
  },
  {
   "target_id": "target-chromium-1440-trials__nct04469465",
   "engine": "chromium",
   "page_id": "trials__nct04469465",
   "viewport": {
    "width": 1440,
    "height": 900
   },
   "screenshot_path": "screenshots/B/chromium/1440__trials__nct04469465.html.png",
   "screenshot_sha256": "e698621fefc352df01359a472cffae1f1ad1deba771aae6aae53d0cb2ce1d7f7",
   "metrics": {
    "horizontal_overflow_px": 0,
    "clipped_text_count": 0,
    "label_overlap_count": 26106,
    "unreadable_label_count": 0
   },
   "unavailable_required_fields": [],
   "responsive_alternatives": [],
   "interaction_checks": [
    {
     "trigger": "page_load",
     "passed": true,
     "evidence": "加载完成且无页面错误（networkidle 到达）"
    },
    {
     "trigger": "filter_change",
     "passed": true,
     "evidence": "筛选控件真实点击（文本长度 50744→8764）"
    },
    {
     "trigger": "drill_down",
     "passed": true,
     "evidence": "折叠表真实展开"
    },
    {
     "trigger": "search",
     "passed": true,
     "evidence": "搜索框存在且接受输入（输入后文档文本长度 8761→50623）"
    },
    {
     "trigger": "keyboard",
     "passed": true,
     "evidence": "Tab 1 次后焦点位于 A"
    },
    {
     "trigger": "reduced_motion",
     "passed": true,
     "evidence": "减弱动效模拟下正文完整可见"
    }
   ],
   "visible_text_scan": {
    "passed": true,
    "engineering_tokens_found": [],
    "untranslated_tokens_found": []
   }
  },
  {
   "target_id": "target-chromium-1024-overview",
   "engine": "chromium",
   "page_id": "overview",
   "viewport": {
    "width": 1024,
    "height": 1366
   },
   "screenshot_path": "screenshots/B/chromium/1024__overview.html.png",
   "screenshot_sha256": "9c65444702932d39c38c05b1b6c61679a73732f3fc61560ee861a99741064bba",
   "metrics": {
    "horizontal_overflow_px": 0,
    "clipped_text_count": 0,
    "label_overlap_count": 10941,
    "unreadable_label_count": 0
   },
   "unavailable_required_fields": [],
   "responsive_alternatives": [],
   "interaction_checks": [
    {
     "trigger": "page_load",
     "passed": true,
     "evidence": "加载完成且无页面错误（networkidle 到达）"
    },
    {
     "trigger": "filter_change",
     "passed": true,
     "evidence": "筛选控件真实点击（文本长度 24290→2482）"
    },
    {
     "trigger": "drill_down",
     "passed": true,
     "evidence": "折叠表真实展开"
    },
    {
     "trigger": "search",
     "passed": true,
     "evidence": "搜索框存在且接受输入（输入后文档文本长度 24290→24290）"
    },
    {
     "trigger": "keyboard",
     "passed": true,
     "evidence": "Tab 1 次后焦点位于 A"
    },
    {
     "trigger": "reduced_motion",
     "passed": true,
     "evidence": "减弱动效模拟下正文完整可见"
    }
   ],
   "visible_text_scan": {
    "passed": true,
    "engineering_tokens_found": [],
    "untranslated_tokens_found": []
   }
  },
  {
   "target_id": "target-chromium-1024-efficacy",
   "engine": "chromium",
   "page_id": "efficacy",
   "viewport": {
    "width": 1024,
    "height": 1366
   },
   "screenshot_path": "screenshots/B/chromium/1024__efficacy.html.png",
   "screenshot_sha256": "55624efcce932ae1f10f477f407971e55548bbe4468a893bcbfc44f270edcf10",
   "metrics": {
    "horizontal_overflow_px": 0,
    "clipped_text_count": 0,
    "label_overlap_count": 3822,
    "unreadable_label_count": 0
   },
   "unavailable_required_fields": [],
   "responsive_alternatives": [],
   "interaction_checks": [
    {
     "trigger": "page_load",
     "passed": true,
     "evidence": "加载完成且无页面错误（networkidle 到达）"
    },
    {
     "trigger": "filter_change",
     "passed": true,
     "evidence": "筛选控件真实点击（文本长度 18201→1407）"
    },
    {
     "trigger": "drill_down",
     "passed": true,
     "evidence": "折叠表真实展开"
    },
    {
     "trigger": "search",
     "passed": true,
     "evidence": "搜索框存在且接受输入（输入后文档文本长度 18201→18201）"
    },
    {
     "trigger": "keyboard",
     "passed": true,
     "evidence": "Tab 1 次后焦点位于 A"
    },
    {
     "trigger": "reduced_motion",
     "passed": true,
     "evidence": "减弱动效模拟下正文完整可见"
    }
   ],
   "visible_text_scan": {
    "passed": true,
    "engineering_tokens_found": [],
    "untranslated_tokens_found": []
   }
  },
  {
   "target_id": "target-chromium-1024-trials__nct04469465",
   "engine": "chromium",
   "page_id": "trials__nct04469465",
   "viewport": {
    "width": 1024,
    "height": 1366
   },
   "screenshot_path": "screenshots/B/chromium/1024__trials__nct04469465.html.png",
   "screenshot_sha256": "5a8facea5ce2b24056f38df9a4e8f3caa2a95f6a84af1847cd7c4d118355d0b8",
   "metrics": {
    "horizontal_overflow_px": 0,
    "clipped_text_count": 0,
    "label_overlap_count": 34770,
    "unreadable_label_count": 0
   },
   "unavailable_required_fields": [],
   "responsive_alternatives": [],
   "interaction_checks": [
    {
     "trigger": "page_load",
     "passed": true,
     "evidence": "加载完成且无页面错误（networkidle 到达）"
    },
    {
     "trigger": "filter_change",
     "passed": true,
     "evidence": "筛选控件真实点击（文本长度 8730→8733）"
    },
    {
     "trigger": "drill_down",
     "passed": true,
     "evidence": "折叠表真实展开"
    },
    {
     "trigger": "search",
     "passed": true,
     "evidence": "搜索框存在且接受输入（输入后文档文本长度 8730→8730）"
    },
    {
     "trigger": "keyboard",
     "passed": true,
     "evidence": "Tab 1 次后焦点位于 A"
    },
    {
     "trigger": "reduced_motion",
     "passed": true,
     "evidence": "减弱动效模拟下正文完整可见"
    }
   ],
   "visible_text_scan": {
    "passed": true,
    "engineering_tokens_found": [],
    "untranslated_tokens_found": []
   }
  },
  {
   "target_id": "target-chromium-768-overview",
   "engine": "chromium",
   "page_id": "overview",
   "viewport": {
    "width": 768,
    "height": 1024
   },
   "screenshot_path": "screenshots/B/chromium/768__overview.html.png",
   "screenshot_sha256": "84b20a4621d179bbaaeabd9141f75e458c5dcdc26de4a2d280db5da0391f4474",
   "metrics": {
    "horizontal_overflow_px": 0,
    "clipped_text_count": 0,
    "label_overlap_count": 10875,
    "unreadable_label_count": 0
   },
   "unavailable_required_fields": [],
   "responsive_alternatives": [],
   "interaction_checks": [
    {
     "trigger": "page_load",
     "passed": true,
     "evidence": "加载完成且无页面错误（networkidle 到达）"
    },
    {
     "trigger": "filter_change",
     "passed": true,
     "evidence": "筛选控件真实点击（文本长度 24298→2482）"
    },
    {
     "trigger": "drill_down",
     "passed": true,
     "evidence": "折叠表真实展开"
    },
    {
     "trigger": "search",
     "passed": true,
     "evidence": "搜索框存在且接受输入（输入后文档文本长度 24298→24298）"
    },
    {
     "trigger": "keyboard",
     "passed": true,
     "evidence": "Tab 1 次后焦点位于 A"
    },
    {
     "trigger": "reduced_motion",
     "passed": true,
     "evidence": "减弱动效模拟下正文完整可见"
    }
   ],
   "visible_text_scan": {
    "passed": true,
    "engineering_tokens_found": [],
    "untranslated_tokens_found": []
   }
  },
  {
   "target_id": "target-chromium-768-efficacy",
   "engine": "chromium",
   "page_id": "efficacy",
   "viewport": {